{
  "$schema": "https://json-schema.org/draft/2020-12/schema",
  "$id": "https://huggingface.co/datasets/bcv-commons/language-profiles/schema/language_profile.schema.json",
  "title": "Language profile",
  "description": "One of observations.json, decisions.json or external.json for a language and edition: what a drafting agent has to know, recorded with evidence. See README.md for the contract.",
  "type": "object",
  "additionalProperties": false,
  "required": ["iso", "edition", "partition", "entries"],
  "properties": {
    "iso": { "type": "string", "pattern": "^[a-z]{3}$", "description": "ISO 639-3 code of the edition's language." },
    "edition": { "type": "string", "description": "Edition id (bcv-commons/bibles or lexeme-aligner id), or the draft project id when no published edition exists." },
    "partition": { "enum": ["observations", "decisions", "external"] },
    "licence": { "type": "string", "description": "SPDX-like licence of this file: CC0-1.0 for observations; the edition's licence for decisions; per entry for external." },
    "orthography": {
      "type": "object",
      "additionalProperties": false,
      "properties": {
        "normalization": { "enum": ["NFC", "NFD"] },
        "ignore_marks": { "type": "array", "items": { "type": "string", "pattern": "^U\\+[0-9A-F]{4,6}$" }, "description": "Combining marks the validator ignores when matching forms (e.g. tone marks)." }
      }
    },
    "entries": {
      "type": "array",
      "items": { "$ref": "#/$defs/entry" }
    }
  },
  "$defs": {
    "ref": {
      "type": "object",
      "additionalProperties": false,
      "required": ["ref"],
      "properties": {
        "ref": { "type": "string", "pattern": "^[1-3A-Z][A-Z0-9]{2} \\d{1,3}:\\d{1,3}$", "description": "USFM book code, chapter:verse in the edition's numbering." },
        "n": { "type": "integer", "minimum": 1, "description": "Occurrences of the form or pattern in the whole corpus (optional, given once per entry)." },
        "form": { "type": "string", "description": "The exact form found in this verse, when it differs from value (inflection, tone)." }
      }
    },
    "entry": {
      "type": "object",
      "required": ["id", "kind", "value", "confidence", "method", "by", "date", "status"],
      "properties": {
        "id": { "type": "string", "pattern": "^[a-z][a-z0-9_:.-]*$" },
        "kind": { "enum": ["feature", "letter", "gap", "term", "formula", "name"] },
        "value": { "type": ["string", "object"] },
        "pattern": { "type": "string", "description": "Schematic form with <slots> (feature, formula)." },
        "source": { "type": "string", "description": "term: Strong's number (H7458, G2316) or a gloss; formula: the source phrase (Hebrew/Greek or BSB wording); name: the source-language name." },
        "alternatives": { "type": "array", "items": { "type": "object", "required": ["value"], "properties": { "value": { "type": "string" }, "n": { "type": "integer" }, "note": { "type": "string" } } } },
        "evidence": { "type": "array", "items": { "$ref": "#/$defs/ref" } },
        "confidence": { "enum": ["high", "medium", "low"] },
        "method": { "enum": ["corpus-observed", "project-decision", "external"] },
        "by": { "type": "string", "description": "agent:<chapter>, a person, or script:<name>." },
        "date": { "type": "string", "pattern": "^\\d{4}-\\d{2}-\\d{2}$" },
        "status": { "enum": ["observed", "decided", "open", "superseded"] },
        "supersedes": { "type": "string" },
        "codes": { "type": "array", "items": { "type": "string", "pattern": "^(GB\\d{3}|WALS:\\d{1,3}[A-Z])$" } },
        "external_source": { "type": "string", "description": "external only: dataset and licence, e.g. 'gram-struct/external (WALS, CC-BY-4.0)'." },
        "attested": { "enum": ["attested", "by-rule"], "description": "term, formula, name: 'attested' = the value occurs as such in a cited verse; 'by-rule' = built by analogy from the cited models." },
        "words": { "type": "array", "items": { "type": "string" }, "description": "Words of the assisting translation (BSB) this entry answers, lower case: a tool that prepares a verse matches the entry by them, so the same word is never looked up twice." },
        "note": { "type": "string" }
      },
      "allOf": [
        { "if": { "properties": { "kind": { "enum": ["feature", "term", "formula", "name"] } }, "required": ["kind"] },
          "then": { "required": ["evidence"], "properties": { "evidence": { "minItems": 1 } } } },
        { "if": { "properties": { "kind": { "enum": ["term", "formula"] } }, "required": ["kind"] },
          "then": { "required": ["source"] } },
        { "if": { "properties": { "kind": { "enum": ["term", "formula", "name"] } }, "required": ["kind"] },
          "then": { "required": ["attested"] } },
        { "if": { "properties": { "kind": { "const": "name" } }, "required": ["kind"] },
          "then": { "required": ["source"] } },
        { "if": { "properties": { "method": { "const": "external" } }, "required": ["method"] },
          "then": { "required": ["external_source"] } }
      ]
    }
  }
}
